{
  "meta": {
    "name": "致命采访 C1-C5 真实样板数据",
    "version": "0.3.0",
    "source": "基于第002卷第001章至第005章正文，参考《致命采访-分章大纲》《致命采访-分章简纲》《致命采访-事件脉络》抽取。",
    "updatedAt": "2026-06-23"
  },
  "timelineConfig": {
    "defaultStart": "2025-07-05T09:00",
    "defaultEnd": "2025-07-10T02:00"
  },
  "chapters": [
    {
      "id": "C1",
      "title": "厂门口丢失的符",
      "startAt": "2025-07-05T09:30",
      "endAt": "2025-07-07T12:20",
      "input": "电视台确定皮革厂改革专题，叶依人被推回采访前台。",
      "inside": "熊丽压制叶依人并安排张航远；采访现场先呈现改革正面，再被老妇丢符撕开裂口。",
      "output": "采访线从改革宣传转向病患家庭和符纸异常。"
    },
    {
      "id": "C2",
      "title": "逼仄小屋里的男人",
      "startAt": "2025-07-07T16:27",
      "endAt": "2025-07-07T22:00",
      "input": "老妇要求采访组去家里看惨状，厂门口冲突留下强现场刺激。",
      "inside": "采访组进入老家属楼，确认病患家庭真实困境；叶依人因现场危险决定撤离。",
      "output": "素材被熊丽认定可用，张航远被训斥后出现受挫和代偿。"
    },
    {
      "id": "C3",
      "title": "第二天的暗访",
      "startAt": "2025-07-08T07:30",
      "endAt": "2025-07-08T13:30",
      "input": "张航远受挫后想补充核实，叶依人也放不下老妇家的安全。",
      "inside": "两人分别私下回到老家属区，老妇失控暴起，张航远救下叶依人并受伤。",
      "output": "张航远的正义叙述刺中叶依人，但她意识到此事牵涉杨家旧账。"
    },
    {
      "id": "C4",
      "title": "听溪茶舍的冷静",
      "startAt": "2025-07-09T01:30",
      "endAt": "2025-07-09T14:00",
      "input": "叶依人被旧厂苦难、张航远勇气和杨家关系同时压住。",
      "inside": "叶依人深夜找禹树，禹树冷拆事实链；次日家庭会议把采访问题转成产业旧账和核查任务。",
      "output": "林倩提出名单、诊断、补贴和联系网络的数据化方案。"
    },
    {
      "id": "C5",
      "title": "电视台的正式任务",
      "startAt": "2025-07-09T15:27",
      "endAt": "2025-07-10T01:00",
      "input": "家庭会议后，旧厂问题已进入杨家风险视野，但电视台仍掌握剪辑和采访口径。",
      "inside": "熊丽正式安排一周跟进报道；莫妮卡要求林倩以个人助理身份入组。",
      "output": "三人调查组形成，张航远把正式任务误解为正义授权并暴露更深风险。"
    }
  ],
  "characters": {
    "yiren": {
      "name": "叶依人",
      "short": "叶",
      "color": "#087268",
      "soft": "#e0f0ed"
    },
    "zhang": {
      "name": "张航远",
      "short": "张",
      "color": "#b42b40",
      "soft": "#f3d7de"
    },
    "xiongli": {
      "name": "熊丽",
      "short": "熊",
      "color": "#536761",
      "soft": "#edf2f0"
    },
    "yangxinrui": {
      "name": "杨心蕊",
      "short": "杨",
      "color": "#a66a10",
      "soft": "#f3e4c8"
    },
    "monica": {
      "name": "莫妮卡",
      "short": "莫",
      "color": "#315f83",
      "soft": "#dbe8f1"
    },
    "yushu": {
      "name": "禹树",
      "short": "禹",
      "color": "#6b4f86",
      "soft": "#e9e1f0"
    },
    "linqian": {
      "name": "林倩",
      "short": "林",
      "color": "#a66a10",
      "soft": "#f3e4c8"
    },
    "laofu": {
      "name": "丢符老妇",
      "short": "老",
      "color": "#6f7d79",
      "soft": "#e7ecea"
    }
  },
  "tracks": [
    {
      "id": "main",
      "name": "故事主轴",
      "sub": "采访裂口到正式任务",
      "expanded": false,
      "characters": [],
      "color": "#536761",
      "soft": "#edf2f0"
    },
    {
      "id": "interview",
      "name": "采访线",
      "sub": "叶依人行动",
      "expanded": true,
      "characters": [
        "yiren",
        "zhang",
        "linqian"
      ],
      "color": "#087268",
      "soft": "#dcefed"
    },
    {
      "id": "temple",
      "name": "符与病患线",
      "sub": "大仙祠前置信号",
      "expanded": true,
      "characters": [
        "laofu",
        "yiren",
        "zhang"
      ],
      "color": "#67558a",
      "soft": "#e7e2ef"
    },
    {
      "id": "family",
      "name": "杨家旧账线",
      "sub": "产业风险内化",
      "expanded": true,
      "characters": [
        "yiren",
        "yushu",
        "monica",
        "yangxinrui",
        "linqian"
      ],
      "color": "#5e6840",
      "soft": "#e8ecd8"
    },
    {
      "id": "media",
      "name": "电视台线",
      "sub": "口径和剪辑权",
      "expanded": false,
      "characters": [
        "xiongli",
        "yiren",
        "zhang"
      ],
      "color": "#315f83",
      "soft": "#dbe8f1"
    },
    {
      "id": "proof",
      "name": "职业病证据线",
      "sub": "样本与数据边界",
      "expanded": false,
      "characters": [
        "yiren",
        "linqian",
        "zhang"
      ],
      "color": "#4f6f5f",
      "soft": "#e1ebe6"
    },
    {
      "id": "zhang",
      "name": "张航远线",
      "sub": "正义感与失控风险",
      "expanded": true,
      "characters": [
        "zhang",
        "yiren",
        "xiongli"
      ],
      "color": "#7a4f68",
      "soft": "#eadfe5"
    }
  ],
  "events": [
    {
      "id": "E001",
      "kind": "story",
      "track": "main",
      "startAt": "2025-07-05T09:30",
      "endAt": "2025-07-07T09:20",
      "title": "电视台确定皮革厂专题",
      "code": "E001 / C1",
      "input": "皮革厂改革与员工持股被定为深度专题，叶依人被高层推到前台。",
      "output": "叶依人重新进入记者身份，张航远作为新助理进入采访组。",
      "risk": "如果只看成普通工作安排，会漏掉电视台和杨家利益的前置压力。",
      "visualState": "normal"
    },
    {
      "id": "E002",
      "kind": "story",
      "track": "main",
      "startAt": "2025-07-07T11:50",
      "endAt": "2025-07-07T12:20",
      "title": "厂门口老妇丢符",
      "code": "E002 / C1",
      "input": "正面采访刚结束，皮革厂改革叙事仍保持体面。",
      "output": "老妇抓住叶依人要求去家里看惨状，符纸与病患家庭第一次进入镜头。",
      "risk": "这是全卷第一个裂口，不能被写成单纯闹事。",
      "visualState": "risk"
    },
    {
      "id": "E003",
      "kind": "story",
      "track": "main",
      "startAt": "2025-07-07T16:27",
      "endAt": "2025-07-07T18:40",
      "title": "老家属楼惨状",
      "code": "E003 / C2",
      "input": "老妇把采访组带进厂区对面的老家属楼。",
      "output": "采访组确认病患家庭困境真实，但现场存在窥视、威胁和失控风险。",
      "risk": "苦难不能直接被消费成素材，必须保留采访伦理和现场危险。",
      "visualState": "normal"
    },
    {
      "id": "E004",
      "kind": "story",
      "track": "zhang",
      "startAt": "2025-07-07T18:40",
      "endAt": "2025-07-08T02:00",
      "title": "张航远受挫与暗面浮现",
      "code": "E004 / C2-C3",
      "input": "熊丽肯定素材冲突性，同时训斥张航远不懂分寸。",
      "output": "张航远把职业受挫转成个人化情绪，为第二天私自暗访埋下动机。",
      "risk": "他不是单纯热血记者，能力、欲望和自负必须同时被看见。",
      "visualState": "risk"
    },
    {
      "id": "E005",
      "kind": "story",
      "track": "main",
      "startAt": "2025-07-08T07:30",
      "endAt": "2025-07-08T12:30",
      "title": "第二天暗访与老妇暴起",
      "code": "E005 / C3",
      "input": "张航远以补充核实名义私下回访，叶依人也低调探望老妇。",
      "output": "老妇失控暴起，张航远救下叶依人；两人短暂拉近，职业病疑云转向群体性问题。",
      "risk": "动作场面只是表层，核心是采访组发现自己无法掌控现场秩序。",
      "visualState": "risk"
    },
    {
      "id": "E006",
      "kind": "story",
      "track": "main",
      "startAt": "2025-07-09T01:30",
      "endAt": "2025-07-09T13:30",
      "title": "听溪茶舍与家庭会议",
      "code": "E006 / C4",
      "input": "叶依人被张航远的正义叙述触动，也意识到皮革厂牵涉杨家旧账。",
      "output": "禹树和家庭会议把情绪性采访拆成名单、诊断、补贴和网络核查任务。",
      "risk": "这一章的作用是降温，不是给苦难一个即时道德答案。",
      "visualState": "warn"
    },
    {
      "id": "E007",
      "kind": "story",
      "track": "main",
      "startAt": "2025-07-09T15:27",
      "endAt": "2025-07-10T00:30",
      "title": "电视台正式任务与林倩入组",
      "code": "E007 / C5",
      "input": "前期素材被电视台认可，杨家内部也已意识到调查风险。",
      "output": "跟进报道正式化，林倩以个人助理身份入组，三人调查组形成。",
      "risk": "正式任务是授权也是包装，电视台仍保留剪辑和定性权。",
      "visualState": "normal"
    },
    {
      "id": "I001",
      "kind": "story",
      "track": "interview",
      "startAt": "2025-07-05T09:30",
      "endAt": "2025-07-07T12:20",
      "title": "采访从改革宣传裂开",
      "code": "C1",
      "input": "叶依人按正面改革专题进入现场，张航远暗中捕捉旧厂裂缝。",
      "output": "厂门口老妇让采访线转向病患家庭和符纸异常。",
      "risk": "采访主线必须压住宣传线与猎奇线。",
      "visualState": "normal"
    },
    {
      "id": "I002",
      "kind": "story",
      "track": "interview",
      "startAt": "2025-07-07T16:27",
      "endAt": "2025-07-08T13:30",
      "title": "个案回访变成现场失控",
      "code": "C2-C3",
      "input": "采访组想确认老妇家的真实处境。",
      "output": "个案不再只是采访对象，而暴露出楼道邻里、病患家庭和安全边界。",
      "risk": "不能把事件写成简单的勇敢深入，现场风险是实质约束。",
      "visualState": "risk"
    },
    {
      "id": "I003",
      "kind": "story",
      "track": "interview",
      "startAt": "2025-07-09T15:27",
      "endAt": "2025-07-09T23:30",
      "title": "正式跟进报道获批",
      "code": "C5",
      "input": "电视台看到素材价值，张航远渴望继续追查。",
      "output": "采访线从零散行动转为一周跟进报道。",
      "risk": "跟进报道的名义光明，但口径仍受电视台控制。",
      "visualState": "normal"
    },
    {
      "id": "T001",
      "kind": "story",
      "track": "temple",
      "startAt": "2025-07-07T11:50",
      "endAt": "2025-07-08T12:30",
      "title": "符纸异常和病患精神结构显形",
      "code": "C1-C3",
      "input": "老妇围绕符纸崩溃，病患家庭的痛苦无法用普通劳资纠纷解释。",
      "output": "大仙祠尚未明牌，但符纸、恐惧和家属互相窥视已经成为前置信号。",
      "risk": "此阶段只能写前兆，不能提前把大仙祠结论说死。",
      "visualState": "warn"
    },
    {
      "id": "T002",
      "kind": "story",
      "track": "temple",
      "startAt": "2025-07-08T08:40",
      "endAt": "2025-07-09T15:27",
      "title": "附近十几家成为悬置问题",
      "code": "C3-C5",
      "input": "老妇多次提到附近还有类似家庭，但事实来源混杂。",
      "output": "问题被禹树和林倩拆成名单、诊断和联系网络。",
      "risk": "群体性不能只靠一句口述成立，必须后续样本化。",
      "visualState": "warn"
    },
    {
      "id": "F001",
      "kind": "story",
      "track": "family",
      "startAt": "2025-07-09T01:30",
      "endAt": "2025-07-09T13:30",
      "title": "杨家旧账被放到桌面",
      "code": "C4",
      "input": "叶依人把私下遭遇告诉禹树和家庭会议。",
      "output": "老林交代皮革厂历史承诺和多年补贴，杨心蕊意识到改革会被旧账反噬。",
      "risk": "家族线不能替代采访线，只能解释为什么事情不能简单热血推进。",
      "visualState": "warn"
    },
    {
      "id": "F002",
      "kind": "story",
      "track": "family",
      "startAt": "2025-07-09T19:30",
      "endAt": "2025-07-09T22:30",
      "title": "莫妮卡安排林倩入组",
      "code": "C5",
      "input": "莫妮卡担心叶依人被电视台、病患和张航远情绪裹挟。",
      "output": "林倩以个人助理身份加入，既协助采访，也私下记录风险。",
      "risk": "林倩的身份必须保持隐蔽，否则会破坏采访合法性和家族边界。",
      "visualState": "normal"
    },
    {
      "id": "M001",
      "kind": "story",
      "track": "media",
      "startAt": "2025-07-05T09:30",
      "endAt": "2025-07-07T12:20",
      "title": "熊丽压制叶依人并配置助理",
      "code": "C1",
      "input": "叶依人刚从事业低谷回到正式采访。",
      "output": "熊丽用传播逻辑压制她，并把张航远安插到采访组。",
      "risk": "熊丽既是管理者也是口径风险源，不能只写成普通上司。",
      "visualState": "normal"
    },
    {
      "id": "M002",
      "kind": "story",
      "track": "media",
      "startAt": "2025-07-07T18:40",
      "endAt": "2025-07-07T21:30",
      "title": "素材审片和责任切割",
      "code": "C2",